{
  "schema": "kinetic/gym/curriculum-job@0.1",
  "job_id": "test9-killresume",
  "type": "ReferenceStudy",
  "status": "running",
  "schedule_ref": null,
  "input": {},
  "checkpoint": null,
  "work_items": [
    {
      "id": "case-test9",
      "state": "pending",
      "attempts": 0,
      "last_error": null,
      "error_class": null,
      "receipt_ref": null
    }
  ],
  "lock": null,
  "budget": {
    "token_class": null,
    "max_candidates": 15,
    "wall_clock_seconds": null
  },
  "provider_notes": [],
  "started_at": "2026-08-22T05:47:09.453Z",
  "finished_at": null
}